iTruth about blockchain|There are many misleading stories about blockchain. Much of the stories are about cryptocurrencies that led to incredible wealth or nightmare losses, or form the basis for a new financial system that supports dark markets for weapons or drugs. Blockchain is also considered a technology with enormous energy requirements. The variety of design and application possibilities of this technology and the opportunities thvat result from it are omitted from these stories.
Blockchain demystified: Distributed data management.|This course explains blockchain beyond this garish and sensational image. Blockchain is above all a technology for distributed, flexible and individualized data management. Essentially, the data refers to participants, documents and transactions that change the status and characteristics of the participants or the things described in the documents.
Blockchain: Grouped distributed consensus technology.|Strictly speaking, blockchain and distributed technology is less a technology itself, but rather a technology group that can be characterized, at least from an algorithmic point of view, via a protocol of chaining, distribution, and consensus. The basic principles have been known for a long time and have also been used in the context of public data security.
Decentralized chain of linked blocks.|A blockchain is initially a chain of blocks. These blocks, in which transactions are stored, are linked together. The storage location is the so-called ledger (account book or journal, which is known from accounting). Blockchains are stored decentrally in a peer-to-peer (P2P) network. A ledger is therefore a kind of distributed account book for the permanent and tamper-proof storage of transaction data. Each computer on the distributed P2P network maintains a copy of this account book to avoid a single point of failure (SPOF). All copies of the blockchain are updated and validated at the same time.
Information on transactions and participants.|Transaction data is information about transactions. They usually refer to the time of the transaction, the participants executing or affecting the transaction, and the things or assets to which the transaction relates. A transaction can be considered as a sequence of an exchange of information for a specific purpose (e.g. sale of a bond). The exchange of information is considered a closed unit. Transaction data can be financial, logistical, or production-related in nature and can relate to a purchase, delivery status, hours worked, insurance premium, or claim.
Mapped transaction data in blockchain-ledger.|Transaction data related to a specific item, document, or asset is mapped in a blockchain, which in turn is stored in a ledger along with all other blockchains. A document can be a patient file, the presentation of a claim, a certificate of completion or a certificate. The documents can also describe assets, such as land, holdings or cars. But they can also refer to goods or services.
Central data management: basics|Centralized and decentralized data managing. Central data management. In central systems, the components are arranged around a central component and connected to it. In contrast, the components of distributed systems form a network of connected components without having central elements of coordination or control. Centralized databases have been used by organizations for many years to store customer data and transaction records of one type or another, among other things.
Central data management: control and privileges|There are carefully monitored and closed systems in which only privileged users are allowed to make entries. For example, when a customer transfers money from one bank account to another, they ask the bank to do so on their behalf instead of dealing directly with the bank's transaction system. Centralization is associated with the paradigm of central control. This has other implications. A central system is a system that, by definition, has a critical source of failure. It also implies a concentration of power when some privileged users have the prerogative to manipulate transactions, for example, for unilaterally canceling a transaction or charging fees.
Central data management: risk of SPOF|Central data management carries the risk of single point of failure (SPOF). A SPOF is generally a potential risk arising from an error in the design, implementation, or configuration of a system, where this error or malfunction causes the overall system to become functional. In an IT environment, a single point of failure can thwart the availability of IT services. Imagine an IT environment in which a single server runs a specific application. If the server were to fail, all services accessing this application would also fail or at least behave unstable.
Central data management: server failure|The loss of data can also result from the server failure. If a SPOF poses a serious threat, a second (or even third) server is often deployed that can mirror the services of the first server and take on its role in the event of a failure.
Decentralized data management: advantages|Advantages of distributed systems  over single and powerful computers (which are necessary for central systems): Higher computing power: The computing power of a distributed system results from the combination of the computing power of all connected computers. Therefore, distributed systems usually have more computing power than any individual computer. Cost reduction: The cost of creating, maintaining, and operating a central supercomputer is much higher than the cost  of creating, maintaining, and operating a distributed system.
Decentralized data management: further advantages|In particular, the replacement of individual computers of a distributed system can be done without significant effects on the overall system. Higher reliability: A distributed system  does not have a single point of failure. The reliability of a distributed system is based on the fact that the entire computer network can continue to work even in the event of a crash of individual computers. The ability to grow naturally. The computing power of a distributed system results from the aggregated computing power of its components.
Decentralized data management: disadvantages|An increase in computer performance is possible by connecting additional computers to the system. The disadvantages of distributed systems compared to central individual computers are: Coordination effort: Distributed systems do not have central entities that coordinate their members. Coordination must be carried out by the members of the system themselves. Communication effort: Coordination requires communication. Computers that form a distributed system must communicate with each other. 
Decentralized data management: further disadvantages|This requires the presence of acommunication protocol, as well as the sending, receiving, and processing of messages.  Security issues: Sending data over a network implies security concerns, as untrusted users may misuse the network to access and use data without authorization. The less restricted access to the network over which the distributed nodes communicate, the higher the security concerns for the distributed system. Decentralized communication with equal nodes.
Peer-to-peer systems: basics|Peer-to-peer systems are a special kind of distributed systems. They consist of individual. computers that make their computing resources directly available to all other members of the network without a central coordination point. When joining a peer-to-peer system, users turn their computers into node computers of the system that are the same in terms of their rights and roles. All nodes in the system have the same functionality and responsibility. All users' computers are both providers and consumers of resources.
Decentralized communication vs. client-server model|A peer-to-peer network is a decentralized communication model in which each node on the network has the same capabilities and can establish communication with all other nodes. Unlike the client-server model, where the client sends a request to a server that is implemented by it, in the P2P network each node can assume the role of client or server. P2P systems can be used to provide anonymized routing of data traffic, parallel computing environments, distributed data storage and other functions. P2P has historically gained notoriety through the sharing of movies, music, digital books and other media.
Anonymized routing|P2P systems can be used to provide anonymized routing of data traffic, parallel computing environments, distributed data storage and other functions. P2P has historically gained notoriety through the sharing of movies, music, digital books and other media. It is, therefore, often associated with software piracy and copyright infringement.
User control in peer-to-peer networks.|As a rule, peer-to-peer applications allow their users to control many parameters: How many node connections should be searched for or allowed at the same time, which systems should the network connect to and which should not, which services should be offered and how many system resources should be made available for the network. Some nodes may limit themselves to simply connecting to a subset of active nodes on the network. In principle, however, there is little user control in P2P networks.
Benefits of peer-to-peer networks|The decentralized structure of the blockchain, unlike traditional centralized approaches, brings with it several important features: Transparency: It is possible for anyone to track the movement of funds from one account to another. Immutability: Once confirmed, a transaction cannot be undone. Low cost: Transaction fees are minimal.
Further benefits of peer-to-peer networks|Cross-border: Funds or assets can be sent to someone on the other side of the globe as easily as to someone in the next room. Speed: Due to the flat and transparent structure of the blockchain, transfers are displayed almost immediately and usually confirmed in minutes instead of hours or days.
Distributed ledger: basics|Ledgers or account books have been around for a long, long time. In the past, of course, they were only available in paper form. With increasing digitalization, the account books are managed digitally. Traditionally, a central authority has been responsible and responsible for validating ledger entries. For example, banks are required to review financial transactions. However, the original form of the ledger still serves as a metaphor for the secure storage of transaction data. Computerized ledgers usually mirror what once existed on paper.
Distributed ledgers: Advanced, decentralized recording.|Now, the technology of the 21st century has taken the next step with cryptography, advanced algorithms, stronger and almost universally available computing power to make the distributed attitude of ledgers a more viable form of recording. Unlike traditional databases, distributed ledgers have neither a central data store nor centralized management functions. In a distributed ledger (or ledger), each node processes and verifies each entry, generating a record for each entry, and seeking consensus on the accuracy of that entry.
Efficient, secure, transparent distributed ledgers.|Distributed ledger technologies have the potential to speed up transactions by eliminating the need for a central instance. Similarly, distributed ledgers have the potential to reduce costs per transaction. Experts also believe that distributed ledger technology is much more secure because each node of the network contains records, creating a system that is more difficult to manipulate or successfully attack. Many also view a distributed ledger as a much more transparent way of sharing shared data and information and observing it together across a network, which also makes a successful cyberattack less likely.
Blockchain - summary|In summary, it can be said: 1· A blockchain or distributed ledger is a new way to store and transmit information. 2· In the simplest case, the blockchain is a digital record stored on a network of computers (possibly even worldwide). 3· Instead of securing information by restricting access, the blockchain shares information among all users. 4· Ownership of assets, for example, is cryptographically verified and the full transparency and shared ownership of the system (among all users) means that a bad actor is immediately recognizable as such and all transactions transmitted by such a node are ignored.
Blockchain and its processes|Transaction: Two parties decide to exchange a thing (property, certificate, etc.). Block: The transaction is packaged with other pending transactions creating a „block“. The block is sent to the blockchain network of participating computers.  Verification: The participating computers (called “miners” in the Bitcoin world) determine whether the transactions are valid. If a majority of computers declare the transactions valid, they are considered valid and a “consensus” among the participants has been reached. Blockchain and its processes (continued) Hash: Each verified block of transactions is time-stamped with a cryptographic hash. Each block holds a reference to the previous block’s hash value. This results in a chain of blocks that can hardly be tampered. Execution: The unit of value moves from the account of one party to the account of the other party.
Two types of records|A blockchain ledger consists of two types of records, individual transactions and blocks. The first block consists of a header and data related to transactions that take place within a specified period of time. The block's timestamp is used to create an alphanumeric string called a hash (a type of unique fingerprint of the transaction).
Hash-based consensus verifies blockchain integrity.|After the first block is created, each subsequent block in the ledger uses the hash of the previous block to calculate its own hash. Before a new block can be added to the blockchain, its authenticity must be verified through a calculation process called validation or consensus. At this point in the blockchain process, much of the nodes on the network must agree and confirm that the hash of the new block has been calculated correctly. Consensus ensures that all copies of the distributed ledger use the same state.
Immutable blocks maintain blockchain integrity.|After a block is added, it can be referenced in subsequent blocks, but cannot be changed. When someone tries to exchange a block or change information stored in it, the hashes for previous and subsequent blocks also change and change the shared state of the blockchain. When consensus is no longer possible, all other nodes on the network are aware that a problem has occurred, and no new blocks are added to the blockchain until the problem is resolved. Typically, the block that caused the problems is discarded and the consensus process is repeated.
Cryprocurrencies - in a few words|A cryptocurrency is a digital medium of exchange that uses encryption to secure the processes implemented in generating money and conducting money transactions. Cryptocurrencies are a subset of digital currencies and therefore have no physical representation. You can't put them in your wallet. They can be used for digital transactions with all business partners who accept them. Transactions with cryptocurrencies are usually carried out through mobile payment from a digital wallet. There are numerous cryptocurrencies around the world. Among them, Bitcoin is the most prominent example.
Altcoins and Bitcoin-to-Bitcoin transactions|In fact, other cryptocurrencies are sometimes referred to as altcoins, alternatives toBitcoin. The Bitcoin protocol enables P2P exchanges in a decentralized system that, unlike traditional currencies, is not associated with a financial institution or government. Bitcoin-to-Bitcoin transactions are made via anonymous, strongly encrypted hash codes on a peer-to-peer network. Each user's digital wallet contains their bitcoins. The wallet also stores all the addresses to which the user sends bitcoin and from which he receives bitcoins, along with a private key known only to the user. The P2P network monitors and verifies the Bitcoin transfers.
Cryptocurrency skepticism impacts blockchain perception.|Due to the positioning of Bitcoin outside the control of state and financial authorities and its potential for abuse as an instrument of fraud, money laundering and other illegal activities, as well as other concerns such as its volatility and the unregulated nature of the exchanges on which Bitcoin is traded, cryptocurrencies are viewed with particular skepticism and concern. This image often rubs off on blockchain technology in general.
Public or private blockchain|Blockchain platforms can be designed either as a public blockchain (without access authorization, permissionless) or private blockchain (with explicit access authorization, permissioned). In a public, permissionless blockchain like Bitcoin, any node on the network (without prior authentication) can transact and participate in the consensus process. In a private blockchain with access authorization, any node can execute transactions, but participation in the consensus process is limited to a limited number of verified nodes.
Consensus and validation in the blockchain|Choosing the consensus algorithm to use is perhaps the most important aspect when choosing a blockchain platform. There are five standard methods to reach consensus. In general, public platforms choose algorithms such as Proof of Work because they require a lot of computing power for computation and are easy to verify for the network nodes involved. Proof-of-Work (PoW). Practical Byzantine Fault Tolerance Algorithm (PBFT). Proof-of-Stake (PoS). Proof-of-Authority (PoA). Proof-of-Honesty (PoH)
Diverse industries explore blockchain applications|The areas of application are manifold and can certainly not be described conclusively here. Much of the early interest in blockchain technology arose around its application in financial transactions. This is understandable when you consider that the cryptocurrency Bitcoin has been used worldwide, proving that blockchain technology can actually work. Banks and other financially relevant institutions have also become early innovators in this area. Other industries, including healthcare, the public sector, agriculture, energy, and many more, are exploring how they can use blockchain to enable the secure exchange of data such as personal health information, digital assets, or real estate data.
Blockchain enables secure supply chains and document exchange|Manufacturing companies and other similar companies also see some potential to use blockchain to manage smart contracts and track materials as they move through their supply chains. Experts believe that blockchain can be used in tax collection, asset transfers, distribution of social benefits, and even voting procedures such as elections. Blockchain can also be used to exchange legal and similar documents such as certificates, testimonials and proofs.
Empowering individuals through decentralized control|Some believe that individuals can use this technology to have better control over personal information and then selectively share parts of their data when necessary; Use cases here include individual medical records and corporate supply chains. In addition, proponents also say blockchains can help better track intellectual property rights and property for art, assets, music, film, and more. Blockchain offers a radically different approach. It firmly manifests the feasibility of peer-to-peer communication over the Internet without the need for a trusted intermediary.
Efficient, secure business transactions with trust|For a company, blockchain offers the following basic possibilities: A design approach that keeps transaction data, value, and status inherently close to business logic. The necessary data schemas for transactional data are easier to manage. Secure execution of business transactions validated by the community of all network users, in a secure process that enables the trust and robust transaction processing that are fundamental to blockchain.
Controlled access authorization for compliance|Access via access authorization as an alternative to uncontrolled access without authorization check, which may meet existing regulations in the company.
Blockchain: Enhanced security and resilience|Experts cite several important benefits for using blockchain. Security is considered one of the main advantages of this technology. It is almost impossible to manipulate a blockchain because information from thousands, even millions of computers, is shared and constantly compared with each other. In addition, blockchain does not have a singular point of failure. If one node fails, this is not a problem because all other nodes have a copy of the ledger. Whether blockchain will revolutionize the way public administration, institutions and industries work is an open question.
Blockchain reliability under scrutiny, diverse applications|Articles in the press have questioned whether blockchain technologies, as they exist now, are sufficiently reliable to deploy on a large scale. Topics include the lack of regulations for this new form of exchange and safety concerns. Blockchains are usually associated with digital currencies such as Bitcoin or alternative versions. However, the fact is that blockchain applications are being researched in many industries as a secure and cost-effective way to create and manage a distributed database and maintain records for digital transactions of all kinds.
Blockchain advantages: Revision, integration, control support|The advantages  of blockchain can be summarized as follows: Revision: Blockchains log transactions, thus establishing regulations for the purpose of non-repudiation, root cause analysis, fraud analysis, etc. Process integration with existing systems: Blockchains ensure that the blockchain solution supports existing systems such as CRM, business intelligence, reporting and analytics, etc. Control: Blockchains support capacity planning (for the network), fraud and error detection.
Blockchain benefits: Reporting, auditing, trust, and efficiency|Reporting and Auditing: Authentication, authorization, and auditing requirements. In a corporate world with access verification, all participants of the blockchain network should be able to be identified and tracked. Their role must be defined if they are to take on certain roles in the blockchain context. Overall, blockchain technology can support a number of models around the handling of business processes by promoting faster settlement, transparency through digitization, symmetrical dissemination of information in supply chains, and the creation of ad hoc trust even between Internet of Things (IoT) services.
Bitcoin drawbacks: Lack of control, technical limitations|Among the many disadvantages of Bitcoin (comparatively slow confirmation times, regular attacks, high energy consumption, etc.), the lack of control over updates and changes to the network and the difficulty of adapting the existing Bitcoin technology to individual needs. For this reason, many organizations prefer to create their own, private blockchain systems with access control. On a technical level, a blockchain can be defined as an immutable ledger or ledger for recording transactions managed in a distributed network of untrusted partners.
Consensus ensures data consistency and integrity|Each peer keeps a copy of the ledger. The peers run a consensus log to validate transactions, group them into blocks, and create a hash chain over the blocks. This process is necessary to ensure the consistency and integrity of the data.
The Ledger|This chapter describes the central element of blockchain technology: the ledger or, to German, the ledger. It explains the architecture of the ledger and the functions and mechanisms for the forgery-proof storage of transaction data.
Blockchain: Cryptographic proof and user anonymity.|The original goal of the blockchain was to support electronic payment systems based on cryptographic proof rather than trust. This basis remains in place, while the diversity of scopes has increased considerably. The primary goal of blockchain is to ensure the anonymity of its users. This is achieved by using a public/private key pair. Each participant is identified by the public key, and authentication (of transactions, for example) is done by signing with the private key.
Blockchain ledger: Immutable transaction log.|The concept of the ledger has its origins in double-entry bookkeeping, where each posting on one account requires a corresponding and opposite posting on another account. This helps to detect errors. In the context of blockchain, a ledger is an indelible log of transactions that take place between different participants. A ledger records which transaction took place (Participant A has transferred asset X to participant B) and in what order these transactions took place (Participant A transfers asset X to participant B. Subsequently, participant B transfers amount Y of a currency to participant A).
Immutable and secure ledgers for all participants.|The ledgers are accessible to all participants registered on a particular network (private blockchain), or to the public as a whole (public blockchain). Ledgers are tamper-proof:  no participant can add, delete or change ledger entries once saved. The management of the ledger must be immune to attacks to ensure that the ledger remains secure even if some participants inadvertently or intentionally behave maliciously.
