Unveiling the Divide: Encryption and Decryption in Asymmetric Cryptography|You can only create an encrypted text at a time by looking at the key to the data.  However, it cannot be decrypted because the corresponding key is not available.  However, one can decrypt the encrypted text created with the corresponding counterpart. Due to the asymmetric distribution of cryptographic properties, the two keys can be used to separate the group of members who are able to create encrypted text from the one that can decrypt it.
Cryptography in practical use: Private and public keys|In cryptography in practice, there are two keys, the private key and the public key.
Getting Started with Asymmetric Cryptography: Key Creation and Distribution|The first steps that must be taken with any application of asymmetric cryptography are: Create a pair of complementary keys using cryptographic software. One key becomes the public key, the other one becomes the private key. A specific member keeps the private key to himself, that passes the public key to all other members.
Secure Communication: Public-to-Private Key Encryption in Asymmetric Cryptography|There are two general ways to use the key pair that differ in the direction in which the data flows: public to private. private to public. Public to private: Using asymmetric cryptography here is about sending information to the owner of the private key in a secure way. It works because anyone can create text encrypted with the public key, but only the owner of the private key can decrypt that text and read the message.
Verifying Authorship: Private-to-Public Key Decryption in Asymmetric Cryptography|Private to public: The use of asymmetric cryptography in this direction is about proving authorship. It works because anyone can use the public key to decrypt encrypted text created with the corresponding private key. the fact that encrypted text created with the private key can only be decrypted with the appropriate public key serves as proof that the owner of the corresponding private key has encrypted the message.
Utilizing Asymmetric Cryptography in Blockchain: Account Identification and Transaction Authorization|The blockchain uses asymmetric cryptography to achieve two goals: Identify accounts: User accounts are public cryptographic keys. Authorize transactions: The owner of the account that hands over ownership creates an encrypted text with the corresponding private key. This encrypted text can be validated using the appropriate public key. This is the number of the account that hands over ownership.
Digital Signatures in Blockchain: Ensuring Ownership and Secure Transactions|The blockchain must ensure that only the owner of one account can transfer the associated asset to other accounts. The transfer of ownership is based on a digital security measure corresponding to the handwritten signature and serves the same purpose: Identify an account, Instruction of the owner, which relating to the content of the corresponding transaction and Approval of the execution by adding the data to its transaction history.
Digital Signatures: Ensuring Authenticity and Detecting Fraud in Blockchain|Digital signatures use cryptographic hashing and the flow of information from private to public asymmetric cryptography. The digital signature deals with the following three processes: Create Signature. Validate data using the signature. Identify fraud using the signature
Securing Data Transmission with Digital Signatures: An In-depth Look|Suppose you want to send Schmalkalden in an authorized manner. You write Schmalkalden, create the hash value of this text (216B62CD) and encrypt it with your private key. The encrypted text of the hash value of your message is your digital signature. It is unique in two ways: First, the message can be uniquely traced back to you because you created it with your unique private key. Secondly, it is unique in terms of text because it is based on the digital fingerprint of the message. Both the message and the digital signature are combined in one file.
Verifying Message Authenticity with Digital Signatures: A Step-by-Step Process|Anyone can now check if you have authorized this message by using your public key. The process begins with the message (Schmalkalden). The recipient of the message first calculates the hash value of the message himself, which results in the value 216B62CD. The recipient of your message then decrypts the attached, encrypted text (the digital signature) with your public key. This results in a value of 216B62CD, which is the hash value of this version of your message. The comparison of both hash values completes the check.
Digital Signature Verification: Ensuring Message Integrity and Authenticity|Since both hash values are identical, the recipient can correctly conclude that you signed the message because, firstly, they were able to decrypt the signature with your public keys, and secondly, the message body encountered is indeed the one you wanted to send, since the decrypted text is identical to the hash value of the message.
Detecting Message Tampering: Verifying Message Integrity with Digital Signatures|In the same way that you verify the authenticity of the message, you can determine if your message has been modified: The recipient of the message (or anyone who was able to intercept the message) himself creates the hash value of the modified message (Schmalkladen), which gives the value 898272F7. The recipient of your message then decrypts the digital signature with your public key. This results in 216B62CD as the hash value of the version of the message you wanted to send.
Message Integrity Verification: Detecting Unauthorized Modifications using Digital Signature|The comparison of both hash values shows that they are not identical. This indicates that the message is not your message. Therefore, anyone may find that you have not authorized this message.
Authorization of transactions|By signing and verifying transactions, the transfer of ownership in blockchain is authorized.
Digital Signature Generation: Ensuring Secure Transaction Authorization|To create a digital signature for a transaction, the owner of the account transferring ownership performs the following steps: Description of the transaction with all the necessary information such as the account numbers involved and the transfer amount. Creation of the cryptographic hash value of the transaction data. Encryption of the hash value of the transaction data with the account holder's private key. Linking the transaction to the encrypted text created under point 3 as a digital signature.
Digital Signature Verification: Ensuring Secure Transaction Validation|To verify a transaction, the following steps must be performed: Creation of a hash value of the transaction data to be verified with the exception of the signature. Decryption of the digital signature of the transaction in question with the account number to transfer ownership. Comparison of the hash value of step 1 with the value obtained in step 2. If both are identical, the transaction is authorized by the owner of the private key, which corresponds to the account transferring ownership, otherwise it will not be authorized.
Key Elements of Digital Signatures for Transactions|Digital signatures of transactional data consist of the following elements: Cryptographic hash values of transaction data. Encrypted text that can be traced back to the corresponding private key of an account.
Unique Characteristics of Digital Signatures in Public-Private Key Cryptography|Due to the fact that cryptographic hash values can be considered digital fingerprints, they are unique to each transaction. An essential feature of public-private key cryptography is that encrypted  text created with a key can only be decrypted with its corresponding counterpart.  The assignment of both keys is unique. With this property, digital signatures can serve as proof that the owner of the private key used to create the digital signature actually agrees with the content of the transaction.
Preserving Transaction Order and Ensuring Data Integrity in Blockchain|The challenge is to store all transaction data that has ever taken place in such a way that the order in which the transactions took place is preserved and changes to the data are detected quickly and easily. The rapid detection of changes is important to prevent manipulation of the transaction history.
How Blockchain Detects and Prevents Transaction Manipulation through Hash Reference Renewal|How to detect the manipulation of a transaction? Changing data anywhere on the blockchain requires the renewal of all hash references, starting with the one that directly references the manipulated data and ending with the head of the entire blockchain as well as all hash references in between.
The Impact of Transaction Modification on the Validity of the Blockchain|What happens if transaction 2 is changed? This transaction is part of a Merkle tree consisting of various hash references. By changing some properties of transaction 2 (e.B. the quantity of goods transferred or the account receiving ownership), the fingerprint or cryptographic hash value is also changed. As a result, the hash reference Ref TA2, which pointed to the original transaction data, is corrupted. It is noted that the originally stated transaction data has been changed in the meantime. As a result, the entire blockchain is invalid.
The Impact of Hash Reference Changes on the Integrity of the Merkle Tree in a Blockchain|What happens when you change not only details of a transaction, but also the hash reference that points to the updated transaction? The updated hash reference (Ref TA2) is valid because it correctly references the new transaction data. However, the updated hash reference is part of a Merkle tree whose root is also a hash reference. The root of the Merkle tree (Ref TA12) points to a data element that contains the hash references Ref TA1 and Ref TA2.
The Consequences of Hash Reference Modifications on the Integrity of the Merkle Tree in a Blockchain|The latter has been modified to match the manipulated version of Transaction 2. Therefore, the cryptographic hash value of the data containing the updated version of RefTA2 also changes, which in turn invalidates the root of the Merkle (partial) tree (Ref TA12).
The Impact of Transaction Replacement and Hash Reference Changes on the Integrity of the Merkle Tree in Blockchain|Replacing a transaction and its hash references in the Merkle tree invalidates the trunk of the Merkle tree, invalidating the entire data structure. Similar to the example above, the root of the Merkle tree Ref TA12 is invalid due to changes that have occurred within the Merkle tree. Therefore, we find that changing a transaction or replacing a transaction will have the same impact on the blockchain data structure. The manipulation is detected in both cases and invalidates the entire data structure.
The Invalidating Effect of Merkle Structure Changes on Blockchain Data Integrity|Changing a Merkle structure invalidates the hash reference that points to the block header that contains it, which in turn invalidates the entire data structure.
Effects of Hash Reference Replacement on Blockchain Data Integrity|Replacement of an entire subtree and its references. Changing a hash reference within a block header invalidates the hash reference that refers to the edited block header, which in turn invalidates the entire data structure.
How to Ensure Data Integrity when Modifying Transactions in the Blockchain|How to properly replace a transaction? The blockchain takes a radical all-or-nothing approach when it comes to changing its data: either you change the entire data structure completely from the point that causes the change to the head of the entire chain, or you better leave it completely unchanged. Properly modifying a transaction entails changing all subsequent hash references. If we consider changing or updating some details of transaction 2, we will then need to update the entire sequence of hash references: Ref TA2, Ref TA12, Ref Block 1 and Ref Block 2.
The Importance of Maintaining Data Integrity in the Blockchain through Proper Modification Procedures|This means that all hash references, starting with the one that points directly to the edited data, and the hash reference, that points to the last block header, as well as all hash references in between, must be changed and updated so that they correctly reflect the changes. This is a rather complex task. All these changes are necessary to keep the entire blockchain data structure consistent and maintain its integrity. All other attempts to modify or manipulate data result in invalid hash references, which in turn invalidates the entire data structure.
Decentralized Trust and Consensus in Blockchain Applications|Blockchain creates consensus and trust between actors who may not know each other at all. In a blockchain application, actors exchange assets such as money, property, services or certificates without a central authority on the authenticity of the exchange actions. This greatly speeds up the processing of the corresponding transactions and paves the way for a completely new generation of transactional applications, especially if consensus can be reached automatically. Instead of a central authority, all actors in the peer-to-peer network of the blockchain application confirm the authenticity of the exchange actions. This joint confirmation is called consensus.
Automated Consensus Mechanisms in Blockchain: Agreement, Closing, and Validity|Whether a transaction is valid is therefore decided by the majority of actors. However, not all actors are asked for their opinions. The consensus should be reached automatically. There are several mechanisms for designing and implementing an automated consensus. In principle, any actor can propose a transaction that is posted to the ledger. At a certain point in time, however, only one transaction is selected for posting. All honest actors agree on which transaction was selected (agreement), all honest participants finally learn which was the selected transaction (closing) and that the selected transaction was considered valid (validity).
Protective Measures in Blockchain: Accounting for Dishonest Actors and Complexity of Manipulation|The protocol of the accounting takes into account that some actors are honest and follow the protocol, while others are dishonest and deviate from the protocol, as in real life, when many people participate in a common cause. A blockchain is open to any actor. But even if it weren't open to every actor, we can't assume that we can trust everyone in the user community. The protective mechanism that offers itself here is to make any kind of manipulation immensely complex.
Principles of Blockchain Technology: Immutable Transaction History and Computational Intensity|In blockchain technology, this is achieved through three principles: Storage of a transaction history in such a way that even the smallest changes to the history are noticed and noticed. Even inserting the smallest detail forces much of the transaction history to be rewritten. Adding, writing, or rewriting data to the transaction history is extremely computationally intensive.
Immutability and Consensus in Blockchain: Detecting Changes and Reaching Consensus|In the previous chapter, it was explained that any change to a transaction also entails a change in its hash value, which is immediately widely visible to all actors. The all-or-nothing principle of blockchain technology requires that even the smallest changes to transaction data require the redesign of the entire Merkle tree, including all the necessary hash puzzles. This makes every change attempt immensely expensive. In a blockchain, actors must repeatedly be able to reach consensus in order to record a transaction (or series of transactions) on the ledger. Usually, the consensus is organized in discrete rounds, in which the participants start the round r + 1 after the round r comes to a close.
Consensus in Blockchain: Proof-of-Work and Consensus by Difficulty|One could assume that a consensus is reached if the majority of actors agree to the decision to attach a particular transaction to the blockchain. A block would be accepted if 51% of the actors agree with this block. However, this is nonsense, as you can never know exactly how many actors are currently on the net. In the blockchain world, the actor is considered a recognized representative of the majority of all actors, who first solves the hash puzzle with a given level of difficulty, i.e., determines the hash value with the given number of leading zeros.
Ensuring Trust and Security: Challenges in Blockchain Community Entry|The mechanism that the actor who solves the hash puzzle represents the majority and is thus allowed to propose a transaction for posting to the ledger is called Proof of Work (PoW).  An actor has to do elaborate and provable work so that he can propose one or more transactions. Basically, in a blockchain community, the same problem arises as when organizing a street gang: how to ensure that someone who wants to join the gang is not a plainclothes police officer, detective, or just a free rider?
Costly Signaling: Proof of Work in Blockchain Consensus|Here, what sociologists call costly signaling is used as an exam: the candidate has to do something expensive and difficult, such as robbing a shop or getting a gang symbol tattooed. Then he is considered trustworthy. In the blockchain world, costly signaling is commonly referred to as proof of work (PoW). In PoW, consensus is reached by holding a lottery among the players to decide which transaction to append next to the ledger. Buying a lottery ticket is a form of costly signaling because it is expensive: expensive in terms of time and energy expenditure. Especially in the PoW lottery, players compete to solve a puzzle. The first actor to solve the puzzle wins the consensus and selects the next block to attach to the ledger. If this block is valid, this actor will also receive a reward, but the other actors will receive nothing and will have to start a new puzzle. Therefore, the work to solve the riddle is adequately remunerated. This wage is intended to compensate for the energy applied (and the use of special hardware) and also to enable a profit. It consists of the current Block Reward, i.e., the salary for writing a new block into the blockchain, and the agreed transaction fees.
Protocol Criteria for Valid Transaction Sequence: Longest Chain vs. Heaviest Chain|Therefore, the idea arose to define a protocol for determining the valid transaction sequence based on the computational effort. Two criteria can be used for this: The criterion of the longest chain. The criterion of the heaviest chain
Consensus on Initial Blockchain Version: Starting Point for Distributed System Actors|The criterion of the longest chain. The criterion of the longest chain is based on the idea that the blockchain data structure, which includes the most blocks, represents the greater computational effort. Let's look for a starting point in which all actors of a distributed system have agreed on the same version of an existing blockchain:
Consensus on Block Addition: Majority Agreement on Block Order in Blockchain|Each of the boxes represents a block marked with a shortened hash value. The arrow pointing from one box to another represents the hash reference that links a block header to its predecessor. In this initial situation, all actors agree on a history of the transaction data and strive for an extension of the existing chain by another block, which refers to block A397 as its predecessor. If a transaction is now proposed for accounting, a new block is written for the blockchain. The following order is the one that the majority of actors will find once the new block has been added.
Delayed Block Transmission: Minority Actors Catching Up with the wrong block|Due to a delay in the transmission of messages, a minority of actors have not yet received block AB12. Therefore, they are still trying to extend the original chain. In the meantime, an actor proposes a new transaction for accounting. Its new block has a hash value of DD01 and is passed to the other actors. The majority of the actors receive both block AB12 and block DD01 as new blocks.
Blockchain Fork: Divergence of Chains with Equal Lengths Based on Different Predecessors|As a result, the majority of actors have a blockchain, which now consists of two branches on a common trunk. In such a situation, the criterion of the longest chain does not give a clear result, since both chains have the same length. Some actors may try to find a new block that points to block AB12 as its predecessor, while other actors may try to find a new block that points to block DD01 as its predecessor.
Simultaneous Block Validation: Multiple Blocks Extending the Same Predecessor|Suddenly, the majority of actors receive two new blocks, BB11 and CCC1, both of which refer to block AB12 as their predecessor. This can happen when two actors complete the proof of work (or other authorization) for their blocks almost simultaneously.
Multiple Branches in Blockchain: Ambiguity in Longest Chain Criterion|The result of incorporating these two new blocks into the blockchain is a data structure that contains three branches. One of the branches consists of only three blocks, while the other two consist of four blocks. The criterion of the longest chain clearly excludes the shortest chain. However, the criterion of the longest chain does not give a clear result during this, as it gives two chains of the same length. As a result, some actors may try to find a new block that refers to block BB11 as its predecessor, while other actors may try to find a new block that refers to block CCC1 as its predecessor.
Resolution of Conflicting Versions: Longest Chain Criterion Establishes Consensus|Finally, a new block is entered, referring to block BB11 as its predecessor, resulting in the following blockchain. It contains many conflicting versions of the transaction history, but the criterion of the longest chain gives a clear result, namely the chain, which consists of blocks 0101 → BB11 → AB12 → A397 → 33FF. The majority of actors and eventually all actors in the system now use this chain to clarify ownership-related requirements that are mapped in transactions. They strive to expand this branch by finding a new block that points to block 0101 as its predecessor.
Determining Validity: The Heaviest Chain Criterion in Dynamic Difficulty Blockchain|The criterion of the heaviest chain. Blockchain applications rarely use a consistent level of difficulty for the puzzle to be solved when a new block is to be added to the blockchain data structure. Instead, they usually determine the difficulty level dynamically, which distinguishes the blocks in terms of the computational effort spent on adding them to the blockchain.
Weighted Chains: Evaluating Computational Effort in Blockchain with the Criterion of Cumulative Difficulty|The criterion of the longest chain is based on the idea that the path containing the most blocks represents the greatest computational effort. With heterogeneous difficulty levels, however, the longest path is not necessarily the one that represents the greatest computational effort. For each path, the computational effort required for this can be set to add up the difficulty of all associated blocks. This value can be calculated using the fact that the block header contains the difficulty level of its hash puzzle. The cumulative difficulty level of a path is often referred to as its weight.
Heaviest Chain: Selecting Blockchain Paths based on Cumulative Difficulty|The longest chain (the path from root 33FF to leaf 0101) has a weight of 5, while the second longest chain (the path from root to leaf CCC1) has a weight of 6. Blockchains that include the level of difficulty use the criterion of the heaviest  chain, in this case the second chain is chosen.
Selecting a Chain: Consequences and Outcomes|Following the selection of a chain. Selecting a particular chain from conflicting versions and determining it as the authoritative order has the following consequences: Orphaned blocks. Reclaimed renumeration. Clarification of ownership. Preparation of transactions. A growing common tribe. Robustness against manipulation
Orphaned Blocks: Abandoned Paths in the Blockchain Tree|Orphaned blocks. The growing blockchain looks like a tree whose branches reflect different versions of the transaction history. Applying a selection criterion (longest or heaviest chain) actually means selecting a path of that tree and setting it as the authoritative version of the transaction data history. All blocks in the tree-shaped data structure that are not part of the authorized path are abandoned by the actors and called orphaned blocks.
Abandoning Blocks: Selection Criteria in Blockchain Consensus|For example, if the criterion of the longest chain is applied to the situation shown again in the previous slide, the blocks DD01 and CCC1 are not part of the longest chain and are abandoned. If the criterion of the heaviest chain is applied to the last situation shown here again, blocks 0101, BB11 and DD01 are not part of the authorized chain and are therefore abandoned.
