Blockchain: Integrity and trust reinforcement.|Maintaining integrity and trust in distributed systems is the main purpose of blockchain. In the context of software systems, integrity is the property of a system to be secure, complete, consistent, correct, and free from manipulation and error.  Trust is the firm belief in the reliability, correctness, or ability of someone or something without having to provide evidence. People will remain loyal toa system if they trust it and if the results of day-to-day interactions with the system confirm and strengthen their trust. Integrity is required to meet users' expectations and strengthen their trust in the system.
Integrity in distributed systems: Peer knowledge and trust.|Achieving and maintaining integrity in purely distributed systems such as blockchains depends on many factors. The two most important are: Knowledge of the number of peers. Knowledge of the trustworthiness of peers. The chances of integrity in a distributed peer-to-peer system are higher if the number of members and their trustworthiness are known (similar to a private club). In a purely distributed peer-to-peer system on the Internet, accessible to everyone, the number of peers and their trustworthiness is inherently unknown.
Integrity threats in peer-to-peer systems: Technical failures and malicious actors.|The two most important integrity threats in peer-to-peer systems are technical failures and members with malicious intent. Dishonest and malicious actors pose the greatest threat to the peer-to-peer system because they attack the foundation on which a peer-to-peer system is based: trust. As soon as users can no longer trust each other, they turn away and leave the system. Achieving integrity and trust is the challenge that blockchain technology faces.
The Byzantine Generals Problem: Achieving Integrity and Trust in Distributed Systems|The problem of achieving and maintaining integrity and trust in a system consisting of an unknown number of members with unknown trustworthiness is well known and widely used in computer science. It is called the problem of Byzantine generals.
The Byzantine Error: Consensus in the Face of Betrayal|In the siege of a city, several generals have a communication problem. Because of the strong fortification, it is necessary for the generals with their troops to attack the city simultaneously from different directions. The generals can communicate with each other via messengers. However, some of the generals intrigue against others. Their goal is to discredit their competitors – for example, by trying to drive the others to a premature attack through cleverly spread misinformation. None of the generals now know what information is authentic and who they can trust. It is therefore a problem of agreement, which consists in the fact that the commanders must decide unanimously whether to attack or not.
The Byzantine Error: Overcoming Betrayal and the Limits of Classical Communication|The problem is complicated by the spatial separation of the commanders; so, they have to send messengers back and forth. There is also the possibility that there may be traitors among the generals who can deliberately send misleading information to the other generals. Mathematically, it turned out that the loyal generals only have a chance of reaching an agreement under these conditions if the proportion of the schemers is less than a third. Thus, there was no solution, especially for three generals, one of whom is a schemer – at least not with the help of classical communication methods such as messengers.
The Byzantine Generals Problem: Consensus in the Face of Betrayal|In the siege of a city, several generals have a communication problem. Because of the strong fortification, it is necessary for the generals with their troops to attack the city simultaneously from different directions. The generals can communicate with each other via messengers. However, some of the generals intrigue against others. Their goal is to discredit their competitors – for example, by trying to drive the others to a premature attack through cleverly spread misinformation. None of the generals now know what information is authentic and who they can trust. It is therefore a problem of agreement, which consists in the fact that the commanders must decide unanimously whether to attack or not.
Blockchain: Revolutionizing Proof of Ownership and Property Management|Integrity and trust are one challenge that the blockchain has to face, the other is the management of property. Proof of ownership includes three elements: Identification of the owner. Identification of the object of which it is the owner. Assignment of the owner to the object. In real life, we use passports, testimonials, birth certificates, serial numbers, and even testimonies to obtain these three elements as evidence. Usually this takes some time.
Blockchain: Transforming Proof of Ownership and Property Management through Immutable Ledgers|The assignment between owners and objects is usually done via a general ledger or register. A ledger  is a concrete implementation of an assignment between owners  and property. Proof of ownership requires the identification of owners and property, as well as the assignment between owners and property. The use of the property requires identification as well as authentication and authorization to ensure that only the legitimate person  legally owns the property.
The Three Pillars of Secure Access: Identification, Authentication, and Authorization|Identification means identifying oneself as a specific person. Authentication means proving that this person is really the one you are working for. Authorization means being able to access something because of the previously authenticated identity.
Double Spending and the Challenge of Consistency in Distributed Peer-to-Peer Systems|Double spending is one of the most important examples of integrity breaches in distributed peer-to-peer systems. After transferring ownership from one person to another, all ledgers of the system must be updated so that the latest version reflects the new reality.  However, sharing information between members in the blockchain system and updating individual ledgers will take time. Some members already know about the last transfer of ownership, while others have not yet received this information. At this point, the system is not consistent.  
The Problem of Double Spending: Counterfeiting in the Digital Realm|Only one of them should be the new and rightful owner. Therefore, the situation is called the problem of double spending. In the context of copying digital goods, the problem of double spending refers to the fact that data can be copied on a computer without significant restrictions. Copying a representation of a unique real object (house, money, cars, etc.) is the digital equivalent of counterfeiting banknotes with a photocopier.
Solving the Double Spending Problem: Blockchain's Integrity Solution|The problem of double spending is an important example of the violation of integrity in distributed peer-to-peer systems of ledgers that   blockchain technology has to solve.
Managing Ownership and Transactions: Blockchain's Tasks in a Peer-to-Peer Environment|Blockchain is software that manages ownership and possession in a purely distributed peer-to-peer system of ledgers, which in turn operates in an open and untrustworthy environment. Blockchain must therefore cope with seven main tasks: Capturing the Transfer of Ownership: Transactions are a good way to describe property transfers. The complete history of transactions is the key to identifying the current owners.
Ensuring Property Protection and Secure Transaction Storage in Blockchain Systems|Property protection has three main elements: identifying and authenticating owners, and restricting access to property to its rightful owners. Storing transaction data. The transaction history is used to clarify ownership. Since transaction history is the core element in the clarification of ownership, it must be stored in a secure manner.
Design Considerations for Immutable and Distributed Ledgers in Untrusted Environments|Design of ledgers for distributed and untrusted environments. The best way to prevent the transaction history from being changed is to make it immutable. This means that the ledger and thus the transaction history can no longer be changed after writing. At the same time, however, it must be able to add new transactions. Distributing the ledgers. Interaction between the members (or nodes) and control of the information is shared between all members.
Ensuring Consensus and Truth in Blockchain Ledgers: Conflict Resolution and Majority Agreement|Add a new transaction to the ledgers. All members of the peer-to-peer system can add new data, while at the same time each member of the peer-to-peer system acts as the supervisor of all members. Decide which ledger represent the truth. Avoiding conflicts between transaction histories is a serious threat to the integrity of the system. The blockchain must decide which transaction history is the truth. It solves the problem by having each node in the peer-to-peer system decide which transaction history is the true one, and the majority of members independently agree to that decision.
Ensuring Transparency and Traceability: Documenting Property Transfer and History|The aim is a transparent and comprehensible documentation of the property. This includes the following aspects: Description of the transfer of ownership. Maintaining transfer history
Recording Ownership Transfer: Account Creation and Transaction Details|Description of the transfer of ownership. A transaction is the transfer of ownership from one owner to another. The act of transfer of ownership is documented with the following facts: Creation of the owner's account. Name of the account to which ownership is to be transferred. Quantity and scope of the property to be transferred.
Key Elements of Ownership Transfer: Timing, Fees, and Consent Verification|The time at which the transaction is to be executed. Optional: A fee payable to the system for executing the transaction. Proof that the owner of the account who hands over ownership actually consents to this transfer.
Transaction History: The Key to Comprehensive Ownership Documentation|Transaction history management. Because the transaction data contains all the information about the account that hands over ownership, the account that receives the property, as well as the item and amount to be transferred, ownership information can be reconstructed for each account as long as the entire transaction history is available. As a result, the entire history of all transaction data is sufficient to document ownership
Preserving Integrity: The Role of Transaction History in Ownership Documentation|The complete history of transaction data is a process chain that provides information about how people acquired and transferred ownership. Any transaction that is not part of this history is considered as if it never happened. A transaction is executed by adding it to the history of the transaction data. The order in which transaction data is added to the history must be preserved. Only transaction data that meets the following three criteria are added to the Blockchain: Formal correctness. Semantic correctness. Authorization
Ensuring Correctness: Formal and Semantic Criteria in Transaction Processing|Formal correctness: The description of a transaction contains all the necessary data and this data is provided in the correct format. Semantic correctness: It focuses on the statement of transaction data and its intended effect. Semantic correctness is often based on business rules, for example: Ensure that no more is spent from the account than allow balance and line of credit. Avoidance of double spending. Limit the number of items/assets that can be transferred in a single transaction.
Enforcing Transaction Limits and Authorization in Blockchain Systems|Limit the number of transactions per user. Limit the total quantity of items/assets that can be sold in a given period. Enforce that an account retains an item/asset for a minimum period of time before it can be further transferred. Authorization. Only the owner of the account who hands over ownership should be allowed to instruct the blockchain to execute a transaction on their behalf.
Securing Data Integrity: Digital Fingerprinting and Hash Functions in Blockchain|In the Blockchain, it is necessary to identify transaction data and possibly any kind of data too unambiguously. This is done with the help of a digital fingerprint. Hash functions accept only one data element as input at a time and create a hash value based on the bits and bytes that make up the data. Hash values can have leading zeros to meet the required length.
Exploring the Properties of Cryptographic Hash Functions in Blockchain|Cryptographic hash functions have the following properties: Quickly create hash values for any type of data: The hash function calculates hash values for all types of data very quickly. Deterministic:  This means that the hash function returns identical hash values for identical input data. Any deviation of the hash values of the data suggests deviations in the input data.
Understanding the Key Properties of Cryptographic Hash Functions in Blockchain Security|Pseudo random:  It is not possible to predict the hash value based on the input data. No reverse engineering of the data: It is impossible to restore the original input data based on the hash value. The hash values say nothing about the content of the input data. Collision-proof: A hash function is called collision-proof when it is very difficult (or impossible) to find two or more different data for which it gives the identical hash value.
Efficient Approaches for Hashing Multiple Data Elements in Blockchain Systems|Hash functions accept only one data element at a time. There is no hash function that accepts multiple independent data at the same time. In reality, however, a single hash value is often needed for a large collection of data. This can be achieved using the following patterns: Independent hashing: means that the hash function is applied to each data element independently. Repeated hashing:  is the repeated application of a hash function to one's own result.
Efficient Strategies for Hashing Multiple Data Elements in Blockchain: Combined, Sequential, and Hierarchical Approaches|Combined hashing: retrieves  a single hash value for more than one data element in one attempt. This is useful when a single hash value is required for a collection of data that is available at any given time. Sequential hashing: is the incremental updating of a hash value when new data arrives. The existing hash value is combined with new data and then passed to the hash function to get the updated hash value. Hierarchical hashing: is the creation of a single hash value for a collection of data. It combines a pair of hash values to form a small hierarchy of hash values with a single value at its top.
Efficient Data Comparison and Change Detection Using Cryptographic Hashing in Blockchain Systems|Hashing is also used to compare data without comparing its content piece by piece. If all cryptographic hash values differ, all the data under consideration is also different. If two or more of the cryptographic hash values are identical, their corresponding input data is also identical.  Comparing hash values is a simple and efficient way to detect changes. if the newly created hash value of certain data and its old value are the same the data hash has not been changed after the old hash value was created.
Ensuring Data Integrity: Detecting Changes Using Collision-Resistant Cryptographic Hash Functions|Detecting data changes is actually a process of comparing data before and after certain events, e.g., after a certain period of time has elapsed, when the data has been stored in a database, retrieved from a database, or sent over a network. Detecting changes to data that should remain unchanged works due to the collision resistance of cryptographic hash functions.
Maintaining Data Integrity with Hash References: Detecting Data Alterations and Ensuring Accuracy|Hash references refer to other data, ensuring that the referenced data has not been altered since the reference was created. In the event that the referenced data has been changed, the reference no longer allows the data to be retrieved. in this case the hash reference is considered incorrect or invalid. The idea of hash reference is to protect its users from retrieving data that has been accidentally altered due to technical errors or intentionally by someone else without informing about it. As a result, an erroneous hash reference is considered an indication that the data has been altered after the hash reference was created.
Ensuring Data Integrity with Concatenation of Hash References: Building Secure Merkle Chains|Concatenation of hash references. Merkle chains. One can store data along with hash references that reference other data, which in turn contain hash references that reference more data, and so on and so forth. If any of the data or hash references are changed after they are created, all subsequent hash references are invalid. Because corrupted hash references serve as evidence that data has been altered after the reference was created.
Chaining Data with Hash References: Building Dynamic Record Structures|Each record contains a hash reference to a different record. Such a structure is useful for storing and linking data that is not completely available at a given time, but arrives step by step continuously. The most recent reference is also known as the head of the chain because it references the currently added record.
Building Chains of Data with Hash References: Sequential Data Integration and Retrieval|The creation of a chain begins with the data element Data 1 and the creation of the hash reference Ref 1. As the first data element, Data 1 does not contain a hash reference. When new data arrives, it is merged with the hash reference that points to Data 1. The hash reference Ref 2 refers to the newly received data and the hash reference Ref 1. The hash reference Ref 3, which refers to Data 3 and the hash reference Ref 2, is generated in a similar way. The hash reference Ref 3 is all you need to access all the data in the chain in reverse order of its arrival.
Merkle Tree: Efficient Grouping and Access of Data through Hash References|Connecting hash references to a tree (also called a Merkle tree) is very useful for grouping many different pieces of data that are available at the same time and making them accessible through a single hash reference.
Building Merkle Trees: Concatenating Hash References for Efficient Data Organization|The process of concatenating to a tree begins with the four transactions data by the boxes at the bottom of the figure.  First, the hash references to the individual transaction data are created (Ref 1 to Ref 4), which are then combined in pairs. Hash references are then generated to the pairs of hash references (Ref 12 and Ref 34). This procedure is repeated until a single hash reference is reached (here referred to as Ref 0).
Using Hash Values and Elaborate Puzzles for Computer Challenges: An Essential Concept in Blockchain|Hash values can also be used to allow computers to challenge other computers with elaborate puzzles. The use of hash values is one of the most important concepts of blockchain. A combination lock is a special lock that requires a unique sequence of numbers to open.  If you do not know the order of the numbers with which the lock can be opened, you can only try to systematically try all possible combinations until you finally reach the clear combination with which the lock opens.
Hash Puzzles: Unlocking the Digital Equivalent of Combination Locks|This procedure is guaranteed to open the lock, but is quite time-consuming. Systematically trying out all possible combinations has nothing to do with knowledge or intellectual thinking. The approach of opening a combination lock in this way is based on hard work. Hash puzzles  or hash puzzles are computer puzzles that can be considered the digital equivalent of the task of opening a combination lock by trying out all sorts of combinations of numbers.
Exploring Hash Puzzles: Elements and Significance in Digital Cryptography|Elements of a hash puzzle are: Predefined data that must remain unchanged. Data that can be freely changed is called nonce. The hash function to apply. Restrictions on the hash value of the combined hashing, also called difficulty level.  Nonce (number that can only be used once)
Solving Hash Puzzles: Trial and Error, Nonce, and Solutions in Digital Cryptography|Hash puzzles can only be solved by trial and error. This also requires guessing a nonce, calculating the hash value of the combined data with the required hash function, and evaluating the resulting hash value based on the restrictions. If the hash value meets all restrictions, the hash puzzle has been solved. Otherwise, you would continue with another nonce until the puzzle is finally solved. The nonce, which in combination with the specified data gives a hash value that meets the constraints, is called a solution. You must always present this particular nonce if you want to claim that you have solved the puzzle.
Solving a Hash Puzzle: Finding a Nonce for a Specific Hash Value|Let's consider a puzzle to illustrate how it works. The shortened hash value of Hello World! is 7F83B165. But what data combined with Hello World! would result in a hash value with three leading zeros? So, the riddle is: Find the nonce, that together with Hello World! results in a hash value starting with three leading zeros. The Nonce 614 solves the puzzle. If the restriction had been to find a hash value with a leading zero, the puzzle would have been solved after just four steps.
Understanding Hash Puzzle Difficulty: The Key to Challenging Computer Systems|The requirement that the hash value meet a certain restriction is the core of the hash puzzle. Therefore, neither the restriction nor its description is arbitrary. Instead, the restriction used by hash puzzles is fixed, allowing computers to challenge other computers with hash puzzles.  In the context of hash puzzles, the restrictions are often referred to as difficulty or level of difficulty.
Decoding Hash Puzzle Difficulty: Unveiling the Significance of Leading Zeros|The difficulty is expressed as a natural number and refers to the number of leading zeros that the hash value must have. So, a difficulty of 1 means that the hash value must have (at least) a leading zero, while a difficulty of 10 means that the hash value must have at least 10 leading zeros. The higher the difficulty level, the more leading zeros are required and the more complicated the hash puzzle.
Proof of Work: Unveiling the Role of Hash Puzzles in Blockchain|Hash puzzles can only be solved by trying them out, which requires a lot of computing power and thus a lot of time and energy. The difficulty level directly affects the average number of attempts required to find a solution, which in turn affects the computing resources or the time required to find the solution. In the context of blockchain, hash puzzles are often   referred to as proof of work because their solution proves that someone has done the work needed to solve it.
Securing Ownership and Exclusivity: Identity and Access Control in Blockchain|The blockchain must uniquely identify participants and assets and ensure that only the rightful owner can access their property. The blockchain is a peer-to-peer system that is open to all. Anyone can connect and provision computing resources or send new transaction data to the system. However, it is not desirable for everyone to access the asset that is assigned to the account managed by the blockchain. An essential feature of private property is its exclusivity. The right to transfer ownership to another account is limited to the owner of the account who hands over ownership.
Public and Private Keys: Ensuring Account Security in Cryptography|The idea of cryptography here is that a public key is used to identify the owner of an account, while access to the account is limited to those people who have the corresponding private key. In cryptography, we use the terms encryption and decryption to protect or remove data. Encrypted data is called encrypted text. What happens if someone tries to decrypt an encrypted text with an incorrect key? The result is a useless pile of numbers, letters, and characters that in no way represent the data that has been encrypted.
Asymmetric Cryptography: The Power of Key Pairs and Message Encryption|Asymmetric cryptography always uses two complementary keys. However, this has a trick: encrypted text created with one of these keys can only be decrypted with the other key and vice versa. Let's say es gives two keys: a yellow and a red key. Together they form the pair of corresponding keys. The original message is encrypted with the yellow key that provides the encrypted text represented in the left blue box.
The Duality of Keys: Flexibility and Limitations in Asymmetric Cryptography|The original message can also be encrypted with the second (red) key, resulting in a different encrypted text displayed in the right blue box. The trick with asymmetric cryptography is that you can't decrypt encrypted text with the key it was created with. The decision as to which key to use for encryption and which to use for decryption is up to  the members. You can change the roles of the keys for each new data element that you want to encrypt. However, you must always have both keys for encryption and decryption.  If you only have one of the keys, the possibilities are limited.
